{
  "name": "Parallel Flow Test",
  "version": "0.1.0-alpha.10",
  "start": "p",
  "steps": {
    "p": {
      "type": "parallel",
      "steps": ["one", "two", "three"]
    },
    "one": {
      "type": "httpjson",
      "url": "https://swapi.tech/api/people/1",
      "method": "GET",
      "headers": {
        "Content-Type": "application/json"
      }
    },
    "two": {
      "type": "httpjson",
      "url": "https://swapi.tech/api/people/2",
      "method": "GET",
      "headers": {
        "Content-Type": "application/json"
      }
    },
    "three": {
      "type": "httpjson",
      "url": "https://swapi.tech/api/people/3",
      "method": "GET",
      "headers": {
        "Content-Type": "application/json"
      }
    },
    "join-step": {
      "type": "join",
      "steps": ["two", "one"],
      "next": "five"
    },

    "five": {
      "type": "httpjson",
      "url": "{{steps.two.output.result.properties.homeworld}}",
      "method": "GET",
      "headers": {
        "Content-Type": "application/json"
      }
    }
  }
}
